show_id,type,title,director,cast,country,date_added,release_year,rating,duration,listed_in,description,year_added,month_added,primary_genre,duration_minutes,seasons
s548,Movie,The Wild Empire 548,Unknown,"Carlos Tanaka, Maria Costa, Wei Patel",South Korea,28-10-2020,2020,TV-Y7,179 min,Horror Movies,A gripping movie exploring themes of survival and identity in South Korea.,2020,October,Horror Movies,179,
s549,TV Show,The Secret Horizon 549,Unknown,"Sara Johnson, Aisha Kumar, Tom Tanaka, Hana Johnson, Priya Garcia",Japan,21-10-2016,2015,PG-13,6 Seasons,Romantic TV Shows,A gripping tv show exploring themes of survival and identity in Japan.,2016,October,Romantic TV Shows,,6
s550,Movie,The Silent Empire 550,Min Lee,"Yuki Garcia, Priya Khan, Sara Lee, Priya Smith",Turkey,05-01-2023,2023,R,168 min,"Independent Movies, Comedies",A gripping movie exploring themes of survival and identity in Turkey.,2023,January,Independent Movies,168,
s551,TV Show,The Endless Storm 551,Unknown,"Elena Kumar, Sara Nair, Yuki Silva, Aisha Nair, Maria Rossi, Sara Patel, David Lee",United States,09-08-2021,2020,R,8 Seasons,"Crime TV Shows, TV Comedies",A gripping tv show exploring themes of survival and identity in United States.,2021,August,Crime TV Shows,,8
s552,Movie,The Last Kingdom 552,Anil Park,"Raj Garcia, John Khan, Tom Garcia, Tom Nair",India,09-08-2026,2025,TV-14,157 min,Sci-Fi & Fantasy,A gripping movie exploring themes of survival and identity in India.,2026,August,Sci-Fi & Fantasy,157,
s553,Movie,The Endless City 553,Min Smith,"Wei Park, John Silva, Aisha Tanaka",Japan,28-07-2026,2023,TV-MA,129 min,"Comedies, Romantic Movies, Children & Family Movies",A gripping movie exploring themes of survival and identity in Japan.,2026,July,Comedies,129,
s554,TV Show,The Broken City 554,Unknown,"Fatima Rossi, Anil Patel, Maria Rossi",India,11-02-2023,2023,TV-MA,6 Seasons,Anime Series,A gripping tv show exploring themes of survival and identity in India.,2023,February,Anime Series,,6
s555,Movie,The Golden Memory 555,Elena Tanaka,"Hana Nair, Raj Costa, Aisha Khan",United Kingdom,02-10-2024,2024,PG-13,146 min,"Dramas, Romantic Movies",A gripping movie exploring themes of survival and identity in United Kingdom.,2024,October,Dramas,146,
s556,TV Show,The Endless City Chronicles 556,Unknown,"Min Nair, Aisha Patel, Hana Müller, Fatima Garcia, Anil Smith",United States,03-03-2022,2019,R,3 Seasons,"TV Action & Adventure, TV Comedies",A gripping tv show exploring themes of survival and identity in United States.,2022,March,TV Action & Adventure,,3
s557,TV Show,The Secret Legacy 557,Unknown,"Wei Park, Aisha Lee, Tom Nair, Raj Patel, Hana Smith, Maria Lee, David Kumar",United States,06-05-2023,2022,R,4 Seasons,"Anime Series, TV Mysteries",A gripping tv show exploring themes of survival and identity in United States.,2023,May,Anime Series,,4
s558,Movie,The Lost Storm 558,Raj Rossi,"Min Müller, John Kumar, Hana Park, Hana Silva",Canada,28-08-2014,2013,R,110 min,Thrillers,A gripping movie exploring themes of survival and identity in Canada.,2014,August,Thrillers,110,
s559,TV Show,The Wild Rebellion 559,Unknown,"Raj Lee, Sara Kumar, Yuki Khan, John Park, Elena Müller, Min Silva, Aisha Lee",Germany,20-03-2022,2021,R,7 Seasons,"Kids' TV, TV Mysteries",A gripping tv show exploring themes of survival and identity in Germany.,2022,March,Kids' TV,,7
s560,Movie,The Eternal Shadows 560,Sara Garcia,"Wei Patel, Aisha Silva, Yuki Nair, Aisha Müller, Yuki Park, John Smith, John Smith",Nigeria,25-09-2024,2024,TV-MA,112 min,Action & Adventure,A gripping movie exploring themes of survival and identity in Nigeria.,2024,September,Action & Adventure,112,
s561,Movie,The Broken Promise 561,Unknown,"Anil Müller, Yuki Nair, Aisha Tanaka, Carlos Costa, Min Patel, Tom Smith",United Kingdom,14-10-2019,2019,TV-Y,83 min,"Sci-Fi & Fantasy, Independent Movies",A gripping movie exploring themes of survival and identity in United Kingdom.,2019,October,Sci-Fi & Fantasy,83,
s562,Movie,The Endless Shadows 562,Unknown,"Carlos Patel, Yuki Khan, Fatima Khan, Aisha Müller, Carlos Kumar",South Korea,12-02-2026,2024,TV-PG,171 min,"Thrillers, Sci-Fi & Fantasy",A gripping movie exploring themes of survival and identity in South Korea.,2026,February,Thrillers,171,
s563,Movie,The Silent Rebellion 563,Aisha Tanaka,"Tom Tanaka, Tom Nair, Anil Costa, Aisha Garcia, Tom Park, Wei Silva, David Patel",United States,01-01-2023,2023,TV-PG,89 min,"Independent Movies, Romantic Movies",A gripping movie exploring themes of survival and identity in United States.,2023,January,Independent Movies,89,
s564,TV Show,The Silent Promise Chronicles 564,Unknown,"Wei Lee, Hana Smith, Priya Kumar, Aisha Kumar, Maria Kumar, Priya Johnson, Tom Kumar",United States,04-04-2013,2009,TV-MA,3 Seasons,"TV Mysteries, TV Action & Adventure, Docuseries",A gripping tv show exploring themes of survival and identity in United States.,2013,April,TV Mysteries,,3
s565,Movie,The Last Legacy 565,Carlos Khan,"Carlos Park, Tom Costa, Fatima Müller, Anil Khan",United States,21-11-2018,2018,PG-13,169 min,"Action & Adventure, Documentaries",A gripping movie exploring themes of survival and identity in United States.,2018,November,Action & Adventure,169,
s566,Movie,The Broken Rebellion 566,John Smith,"Yuki Khan, Wei Smith, Priya Rossi, Sara Nair",Japan,01-11-2022,2021,R,151 min,"Comedies, Sci-Fi & Fantasy, Children & Family Movies",A gripping movie exploring themes of survival and identity in Japan.,2022,November,Comedies,151,
s567,TV Show,The Silent Legacy Chronicles 567,Unknown,"Hana Müller, Aisha Silva, David Müller",Mexico,16-02-2013,2010,PG-13,1 Seasons,Anime Series,A gripping tv show exploring themes of survival and identity in Mexico.,2013,February,Anime Series,,1
s568,TV Show,The Wild Legacy 568,Unknown,"Elena Johnson, Raj Garcia, Fatima Smith, Hana Johnson, Raj Patel",United Kingdom,01-05-2020,2019,TV-Y,3 Season,Romantic TV Shows,A gripping tv show exploring themes of survival and identity in United Kingdom.,2020,May,Romantic TV Shows,,3
s569,TV Show,The Wild Memory 569,Unknown,"Maria Tanaka, Priya Park, Maria Khan, Fatima Rossi, Hana Smith",Nigeria,28-04-2023,2021,R,6 Seasons,TV Dramas,A gripping tv show exploring themes of survival and identity in Nigeria.,2023,April,TV Dramas,,6
s570,Movie,The Broken Empire 570,Hana Khan,"Hana Müller, Fatima Silva, John Johnson, Yuki Garcia",Italy,15-05-2020,2017,NR,165 min,"Thrillers, Independent Movies",A gripping movie exploring themes of survival and identity in Italy.,2020,May,Thrillers,165,
s571,Movie,The Forgotten Memory 571,John Johnson,"Aisha Tanaka, Sara Lee, Priya Rossi, Wei Kumar, Fatima Johnson, Aisha Khan",Turkey,14-08-2016,2012,TV-MA,127 min,"Sci-Fi & Fantasy, Horror Movies",A gripping movie exploring themes of survival and identity in Turkey.,2016,August,Sci-Fi & Fantasy,127,
s572,TV Show,The Dark Horizon 572,Unknown,"Aisha Costa, Wei Lee, Carlos Smith, Hana Müller, Sara Lee",France,12-09-2026,2024,PG-13,7 Season,Crime TV Shows,A gripping tv show exploring themes of survival and identity in France.,2026,September,Crime TV Shows,,7
s573,Movie,The Endless City 573,David Tanaka,"Priya Silva, Yuki Johnson, Hana Patel, Hana Smith, Fatima Park, Priya Johnson, Aisha Müller",United States,11-01-2026,2023,TV-Y,158 min,Romantic Movies,A gripping movie exploring themes of survival and identity in United States.,2026,January,Romantic Movies,158,
s574,Movie,The Endless Kingdom 574,Fatima Silva,"John Rossi, Wei Johnson, David Johnson",Japan,07-06-2024,2023,TV-14,95 min,Children & Family Movies,A gripping movie exploring themes of survival and identity in Japan.,2024,June,Children & Family Movies,95,
s575,TV Show,The Endless Empire Chronicles 575,Unknown,"Maria Nair, Tom Kumar, Anil Lee, Raj Smith, Elena Smith",Canada,01-10-2012,2012,R,5 Season,"TV Mysteries, TV Dramas, Anime Series",A gripping tv show exploring themes of survival and identity in Canada.,2012,October,TV Mysteries,,5
s576,TV Show,The Forgotten Horizon 576,Unknown,"Elena Johnson, Anil Silva, Yuki Park, Min Rossi, John Nair",United Kingdom,09-05-2020,2017,TV-MA,6 Seasons,"TV Comedies, Reality TV",A gripping tv show exploring themes of survival and identity in United Kingdom.,2020,May,TV Comedies,,6
s577,TV Show,The Golden Shadows Chronicles 577,Unknown,"Aisha Tanaka, Wei Smith, Hana Park, Sara Nair, Raj Park",Canada,08-01-2022,2017,R,1 Season,TV Comedies,A gripping tv show exploring themes of survival and identity in Canada.,2022,January,TV Comedies,,1
s578,Movie,The Forgotten Rebellion 578,Tom Khan,"Maria Johnson, Min Smith, Maria Lee, Maria Costa",United States,02-02-2023,2023,TV-PG,108 min,Horror Movies,A gripping movie exploring themes of survival and identity in United States.,2023,February,Horror Movies,108,
s579,Movie,The Eternal Empire 579,Elena Müller,"Fatima Lee, Elena Tanaka, Priya Khan, Yuki Park, Priya Lee, Carlos Müller",United Kingdom,15-11-2023,2021,TV-14,155 min,Independent Movies,A gripping movie exploring themes of survival and identity in United Kingdom.,2023,November,Independent Movies,155,
s580,Movie,The Dark Kingdom 580,Unknown,"Hana Rossi, Tom Tanaka, Elena Smith",United States,23-04-2024,2024,PG,79 min,Children & Family Movies,A gripping movie exploring themes of survival and identity in United States.,2024,April,Children & Family Movies,79,
s581,Movie,The Last Dreams 581,John Garcia,"Sara Silva, Min Nair, Hana Costa, Tom Tanaka",Turkey,25-10-2017,2016,TV-14,137 min,"Romantic Movies, Horror Movies, Children & Family Movies",A gripping movie exploring themes of survival and identity in Turkey.,2017,October,Romantic Movies,137,
s582,Movie,The Hidden Promise 582,Unknown,"John Tanaka, Raj Rossi, Wei Khan",Egypt,06-07-2022,2021,TV-14,157 min,"Sci-Fi & Fantasy, Comedies",A gripping movie exploring themes of survival and identity in Egypt.,2022,July,Sci-Fi & Fantasy,157,
s583,Movie,The Hidden Memory 583,Priya Lee,"Hana Garcia, Tom Patel, Aisha Patel, David Kumar, Min Khan, Sara Smith",United States,17-11-2026,2022,TV-MA,127 min,"Horror Movies, Comedies",A gripping movie exploring themes of survival and identity in United States.,2026,November,Horror Movies,127,
s584,TV Show,The Last Kingdom 584,Unknown,"Fatima Patel, Elena Patel, Aisha Smith, Anil Müller",Spain,24-07-2019,2019,TV-G,7 Seasons,"Kids' TV, TV Action & Adventure",A gripping tv show exploring themes of survival and identity in Spain.,2019,July,Kids' TV,,7
s585,Movie,The Forgotten Dreams 585,Fatima Tanaka,"Tom Silva, Tom Smith, Carlos Park, Fatima Rossi, Hana Garcia, Hana Lee, Yuki Park",Turkey,02-02-2026,2023,TV-14,74 min,"Horror Movies, Documentaries, Comedies",A gripping movie exploring themes of survival and identity in Turkey.,2026,February,Horror Movies,74,
s586,TV Show,The Eternal Promise Chronicles 586,Unknown,"Wei Lee, Priya Garcia, Wei Lee, Min Garcia",United States,01-12-2024,2022,PG-13,2 Seasons,"TV Mysteries, Anime Series, Docuseries",A gripping tv show exploring themes of survival and identity in United States.,2024,December,TV Mysteries,,2
s587,TV Show,The Hidden Journey 587,Unknown,"Sara Rossi, Raj Rossi, Carlos Rossi",Spain,11-07-2026,2024,PG,1 Seasons,"TV Comedies, Crime TV Shows",A gripping tv show exploring themes of survival and identity in Spain.,2026,July,TV Comedies,,1
s588,TV Show,The Wild Dreams 588,Unknown,"Yuki Costa, David Rossi, Elena Park",India,10-11-2022,2021,TV-MA,4 Seasons,TV Comedies,A gripping tv show exploring themes of survival and identity in India.,2022,November,TV Comedies,,4
s589,Movie,The Silent City 589,Yuki Park,"Elena Smith, Fatima Müller, Raj Garcia, Aisha Nair, Carlos Müller",Mexico,16-11-2025,2023,TV-14,102 min,"Children & Family Movies, Dramas",A gripping movie exploring themes of survival and identity in Mexico.,2025,November,Children & Family Movies,102,
s590,Movie,The Eternal City 590,Unknown,"Fatima Müller, Min Patel, Wei Khan",United Kingdom,01-08-2026,2022,TV-Y,101 min,"Thrillers, Romantic Movies, Documentaries",A gripping movie exploring themes of survival and identity in United Kingdom.,2026,August,Thrillers,101,
s591,Movie,The Golden Journey 591,David Nair,"John Silva, Min Johnson, Sara Khan, John Kumar, Elena Müller, Maria Rossi, Maria Patel",Italy,13-06-2025,2025,TV-MA,145 min,"Horror Movies, Sci-Fi & Fantasy",A gripping movie exploring themes of survival and identity in Italy.,2025,June,Horror Movies,145,
s592,TV Show,The Dark Memory 592,Unknown,"Raj Rossi, Anil Tanaka, Yuki Nair, John Kumar, Elena Khan",India,22-09-2020,2019,TV-MA,3 Seasons,"Docuseries, TV Comedies",A gripping tv show exploring themes of survival and identity in India.,2020,September,Docuseries,,3
s593,Movie,The Broken Memory 593,Maria Smith,"Maria Park, Hana Silva, Priya Khan, Carlos Kumar, Elena Lee",United Kingdom,02-01-2018,2018,PG-13,102 min,Romantic Movies,A gripping movie exploring themes of survival and identity in United Kingdom.,2018,January,Romantic Movies,102,
s594,Movie,The Golden Journey 594,Unknown,"Aisha Müller, David Costa, Maria Müller, Hana Khan, Maria Silva, Hana Khan, Yuki Smith",Canada,13-11-2020,2019,PG,124 min,"Comedies, Horror Movies",A gripping movie exploring themes of survival and identity in Canada.,2020,November,Comedies,124,
s595,TV Show,The Endless Horizon 595,Unknown,"Min Park, David Patel, Sara Rossi, Sara Silva, Min Silva, Aisha Rossi, Raj Patel",Mexico,15-11-2026,2025,TV-14,3 Seasons,"TV Comedies, Crime TV Shows",A gripping tv show exploring themes of survival and identity in Mexico.,2026,November,TV Comedies,,3
s596,Movie,The Eternal Horizon 596,Maria Johnson,"Yuki Kumar, Tom Garcia, Tom Müller, Raj Rossi, Min Nair, Anil Smith, Anil Khan",United States,20-03-2011,2011,TV-MA,108 min,Sci-Fi & Fantasy,A gripping movie exploring themes of survival and identity in United States.,2011,March,Sci-Fi & Fantasy,108,
s597,Movie,The Hidden Promise 597,Anil Smith,"Anil Park, Hana Patel, Maria Patel, Elena Garcia, Carlos Müller, Maria Khan, Yuki Park",United States,20-06-2023,2020,TV-PG,82 min,"Sci-Fi & Fantasy, Children & Family Movies",A gripping movie exploring themes of survival and identity in United States.,2023,June,Sci-Fi & Fantasy,82,
s598,Movie,The Secret Legacy 598,Unknown,"John Patel, John Tanaka, Hana Smith, Elena Kumar, Min Silva, Anil Smith, Yuki Silva",Spain,23-10-2020,2018,TV-Y,95 min,Comedies,A gripping movie exploring themes of survival and identity in Spain.,2020,October,Comedies,95,
s599,TV Show,The Golden Memory 599,Unknown,"Raj Garcia, Maria Nair, Carlos Garcia, Hana Rossi",Brazil,27-04-2020,2019,PG,5 Seasons,"TV Mysteries, TV Comedies, TV Action & Adventure",A gripping tv show exploring themes of survival and identity in Brazil.,2020,April,TV Mysteries,,5
s600,TV Show,The Forgotten Rebellion 600,Unknown,"Min Silva, Aisha Garcia, Raj Khan",Canada,19-02-2019,2016,TV-MA,8 Seasons,"Docuseries, TV Action & Adventure, Reality TV",A gripping tv show exploring themes of survival and identity in Canada.,2019,February,Docuseries,,8
s601,Movie,The Eternal Legacy 601,Sara Garcia,"Min Khan, Raj Garcia, Sara Patel, Hana Lee, Tom Patel, Priya Garcia",Mexico,19-01-2020,2016,TV-14,108 min,Sci-Fi & Fantasy,A gripping movie exploring themes of survival and identity in Mexico.,2020,January,Sci-Fi & Fantasy,108,
s602,Movie,The Lost Storm 602,Yuki Silva,"Elena Silva, Elena Johnson, Wei Johnson",Mexico,21-06-2023,2020,PG,162 min,"Romantic Movies, Children & Family Movies, Action & Adventure",A gripping movie exploring themes of survival and identity in Mexico.,2023,June,Romantic Movies,162,
s603,Movie,The Lost Kingdom 603,Sara Johnson,"Tom Smith, Anil Kumar, Wei Tanaka, John Müller, John Rossi, Elena Lee, Carlos Costa",South Korea,17-11-2026,2023,R,103 min,Romantic Movies,A gripping movie exploring themes of survival and identity in South Korea.,2026,November,Romantic Movies,103,
s604,Movie,The Lost Promise 604,Unknown,"John Kumar, Priya Rossi, Sara Johnson, Raj Garcia, David Smith",Mexico,06-02-2024,2021,TV-14,163 min,"Thrillers, Comedies",A gripping movie exploring themes of survival and identity in Mexico.,2024,February,Thrillers,163,
s605,TV Show,The Silent Shadows 605,Unknown,"Carlos Tanaka, Wei Silva, Hana Smith, Raj Müller, John Tanaka",India,05-07-2025,2021,TV-MA,4 Seasons,"Anime Series, TV Mysteries",A gripping tv show exploring themes of survival and identity in India.,2025,July,Anime Series,,4
s606,Movie,The Endless Memory 606,Elena Tanaka,"Elena Patel, Sara Lee, Maria Costa, Priya Rossi",Canada,25-06-2016,2011,TV-MA,122 min,"Independent Movies, Comedies, Romantic Movies",A gripping movie exploring themes of survival and identity in Canada.,2016,June,Independent Movies,122,
s607,Movie,The Silent Dreams 607,Unknown,"Carlos Kumar, David Kumar, Carlos Nair, Yuki Nair, Fatima Silva, Sara Smith",United States,28-07-2021,2020,TV-MA,79 min,"Comedies, Action & Adventure, Horror Movies",A gripping movie exploring themes of survival and identity in United States.,2021,July,Comedies,79,
s608,Movie,The Hidden Legacy 608,Yuki Silva,"Anil Patel, John Johnson, Elena Khan, Raj Kumar, David Silva, Fatima Tanaka, David Costa",United States,18-02-2024,2023,PG-13,143 min,Independent Movies,A gripping movie exploring themes of survival and identity in United States.,2024,February,Independent Movies,143,
s609,TV Show,The Silent Dreams 609,Unknown,"Anil Lee, Priya Silva, Priya Patel",India,18-04-2019,2018,PG-13,6 Season,Anime Series,A gripping tv show exploring themes of survival and identity in India.,2019,April,Anime Series,,6
s610,TV Show,The Endless Memory Chronicles 610,Unknown,"Aisha Rossi, Yuki Costa, Carlos Kumar, Anil Kumar, Hana Patel",United States,02-12-2021,2019,TV-14,2 Season,"Reality TV, Kids' TV",A gripping tv show exploring themes of survival and identity in United States.,2021,December,Reality TV,,2
s611,Movie,The Last Journey 611,Maria Silva,"Maria Smith, Min Smith, Sara Lee, Hana Lee, Aisha Kumar, Carlos Tanaka",Spain,24-11-2024,2021,R,72 min,"Children & Family Movies, Dramas, Thrillers",A gripping movie exploring themes of survival and identity in Spain.,2024,November,Children & Family Movies,72,
s612,Movie,The Hidden City 612,Carlos Nair,"Priya Kumar, Maria Rossi, Wei Khan",Canada,08-01-2022,2022,PG-13,122 min,"Independent Movies, Dramas, Sci-Fi & Fantasy",A gripping movie exploring themes of survival and identity in Canada.,2022,January,Independent Movies,122,
s613,Movie,The Broken Promise 613,Unknown,"Elena Müller, John Müller, Priya Smith, Fatima Patel, Hana Rossi, Sara Nair",Egypt,20-06-2015,2011,TV-14,153 min,Horror Movies,A gripping movie exploring themes of survival and identity in Egypt.,2015,June,Horror Movies,153,
s614,TV Show,The Broken Dreams Chronicles 614,Unknown,"John Kumar, Sara Silva, Elena Khan, Priya Tanaka, Maria Nair",Japan,10-12-2015,2014,TV-MA,6 Seasons,"Kids' TV, Reality TV, Docuseries",A gripping tv show exploring themes of survival and identity in Japan.,2015,December,Kids' TV,,6
s615,Movie,The Golden Journey 615,Maria Kumar,"Min Müller, Min Smith, Raj Rossi, Anil Khan",United Kingdom,18-12-2023,2019,TV-14,96 min,Romantic Movies,A gripping movie exploring themes of survival and identity in United Kingdom.,2023,December,Romantic Movies,96,
s616,Movie,The Endless Legacy 616,Tom Rossi,"Tom Silva, Min Kumar, Carlos Tanaka",United States,10-07-2015,2013,TV-Y7,175 min,Dramas,A gripping movie exploring themes of survival and identity in United States.,2015,July,Dramas,175,
s617,TV Show,The Forgotten Rebellion Chronicles 617,Unknown,"Raj Johnson, David Nair, Fatima Costa, Hana Costa, Raj Lee",South Korea,14-11-2024,2024,TV-MA,1 Seasons,Reality TV,A gripping tv show exploring themes of survival and identity in South Korea.,2024,November,Reality TV,,1
s618,Movie,The Wild Dreams 618,Yuki Nair,"Min Silva, Fatima Garcia, Tom Rossi, Carlos Garcia, Raj Khan, Fatima Smith, Carlos Costa",United States,26-07-2017,2016,TV-G,163 min,"Dramas, Comedies, Thrillers",A gripping movie exploring themes of survival and identity in United States.,2017,July,Dramas,163,
s619,TV Show,The Secret Shadows 619,Unknown,"Raj Smith, Yuki Johnson, David Nair, Fatima Nair, Wei Rossi",Unknown,19-06-2024,2022,TV-PG,7 Season,"Docuseries, Romantic TV Shows, TV Mysteries",A gripping tv show exploring themes of survival and identity in South Korea.,2024,June,Docuseries,,7
s620,Movie,The Forgotten Memory 620,Priya Khan,"David Smith, Min Garcia, Fatima Costa, Fatima Khan, Elena Garcia, Carlos Müller, Wei Garcia",United Kingdom,02-08-2021,2020,TV-14,115 min,"Independent Movies, Documentaries",A gripping movie exploring themes of survival and identity in United Kingdom.,2021,August,Independent Movies,115,
s621,Movie,The Lost Shadows 621,Anil Patel,"Anil Park, Fatima Khan, Raj Müller, Sara Patel",Australia,08-01-2014,2009,R,84 min,"Dramas, Action & Adventure, Children & Family Movies",A gripping movie exploring themes of survival and identity in Australia.,2014,January,Dramas,84,
s622,TV Show,The Dark Journey 622,Unknown,"John Patel, Priya Tanaka, Hana Lee, Sara Nair, Aisha Smith, Aisha Khan",United States,08-10-2022,2021,R,6 Seasons,Reality TV,A gripping tv show exploring themes of survival and identity in United States.,2022,October,Reality TV,,6
s623,Movie,The Dark Storm 623,Wei Lee,"Yuki Garcia, Raj Smith, Hana Costa",Canada,11-06-2021,2020,PG-13,122 min,"Romantic Movies, Children & Family Movies, Horror Movies",A gripping movie exploring themes of survival and identity in Canada.,2021,June,Romantic Movies,122,
s624,TV Show,The Wild Shadows Chronicles 624,Unknown,"Tom Costa, Priya Smith, Carlos Johnson, Aisha Patel",United States,25-12-2024,2023,TV-G,6 Seasons,"TV Mysteries, TV Dramas",A gripping tv show exploring themes of survival and identity in United States.,2024,December,TV Mysteries,,6
s625,Movie,The Lost Rebellion 625,Yuki Tanaka,"Carlos Costa, Sara Tanaka, Min Lee, John Park, Carlos Rossi",Mexico,16-10-2024,2023,R,154 min,"Independent Movies, Children & Family Movies, Romantic Movies",A gripping movie exploring themes of survival and identity in Mexico.,2024,October,Independent Movies,154,
s626,Movie,The Golden City 626,Carlos Rossi,"Carlos Johnson, Maria Patel, Carlos Costa, Aisha Müller, Maria Johnson, Fatima Costa",Australia,03-06-2023,2020,TV-MA,115 min,"Independent Movies, Comedies, Romantic Movies",A gripping movie exploring themes of survival and identity in Australia.,2023,June,Independent Movies,115,
s627,Movie,The Wild Empire 627,Elena Müller,"Wei Rossi, Raj Garcia, John Silva, Fatima Costa",Canada,04-06-2025,2024,R,80 min,"Thrillers, Independent Movies",A gripping movie exploring themes of survival and identity in Canada.,2025,June,Thrillers,80,
s628,Movie,The Wild Kingdom 628,Raj Park,"Priya Garcia, Tom Silva, Sara Garcia, Tom Park",United States,24-08-2017,2016,TV-14,82 min,Dramas,A gripping movie exploring themes of survival and identity in United States.,2017,August,Dramas,82,
s629,Movie,The Silent Empire 629,Anil Smith,"Min Silva, Min Park, Aisha Khan, Elena Park, Maria Park",France,10-12-2022,2018,TV-Y,85 min,"Romantic Movies, Comedies",A gripping movie exploring themes of survival and identity in France.,2022,December,Romantic Movies,85,
s630,Movie,The Forgotten Storm 630,Sara Müller,"Tom Lee, Min Garcia, Fatima Costa, John Tanaka, Yuki Rossi, David Kumar",United States,27-10-2019,2019,TV-14,135 min,Action & Adventure,A gripping movie exploring themes of survival and identity in United States.,2019,October,Action & Adventure,135,
s631,Movie,The Dark Dreams 631,Wei Garcia,"Hana Silva, Fatima Johnson, David Smith",India,19-09-2013,2011,TV-Y7,135 min,"Horror Movies, Romantic Movies",A gripping movie exploring themes of survival and identity in India.,2013,September,Horror Movies,135,
s632,Movie,The Wild Kingdom 632,Wei Khan,"John Tanaka, Fatima Garcia, John Tanaka, Wei Kumar, Anil Patel",Japan,04-03-2024,2022,TV-14,106 min,"Children & Family Movies, Sci-Fi & Fantasy",A gripping movie exploring themes of survival and identity in Japan.,2024,March,Children & Family Movies,106,
s633,TV Show,The Silent Dreams 633,Unknown,"Aisha Park, Min Patel, Maria Nair, Min Khan, John Park, John Rossi, Aisha Rossi",United States,16-01-2018,2018,TV-Y7,1 Seasons,Docuseries,A gripping tv show exploring themes of survival and identity in United States.,2018,January,Docuseries,,1
s634,TV Show,The Eternal Horizon Chronicles 634,Unknown,"David Garcia, David Khan, Min Müller",United States,22-12-2025,2020,TV-MA,2 Seasons,Kids' TV,A gripping tv show exploring themes of survival and identity in United States.,2025,December,Kids' TV,,2
s635,TV Show,The Eternal Kingdom Chronicles 635,Unknown,"Hana Nair, Anil Müller, Raj Tanaka, Maria Johnson, Tom Nair",United States,23-12-2020,2019,TV-MA,6 Season,"TV Comedies, Reality TV",A gripping tv show exploring themes of survival and identity in United States.,2020,December,TV Comedies,,6
s636,Movie,The Forgotten Kingdom 636,Hana Müller,"Hana Kumar, Aisha Smith, Elena Patel",United States,16-05-2023,2021,TV-MA,89 min,"Action & Adventure, Children & Family Movies",A gripping movie exploring themes of survival and identity in United States.,2023,May,Action & Adventure,89,
s637,Movie,The Dark Storm 637,Unknown,"Elena Patel, Wei Khan, Carlos Khan, Elena Rossi, Tom Johnson",United Kingdom,06-12-2020,2017,R,74 min,"Horror Movies, Thrillers",A gripping movie exploring themes of survival and identity in United Kingdom.,2020,December,Horror Movies,74,
s638,TV Show,The Lost Legacy Chronicles 638,Unknown,"Min Lee, Carlos Müller, Aisha Smith, Wei Rossi, David Müller, John Lee",France,10-08-2014,2012,TV-MA,2 Seasons,Docuseries,A gripping tv show exploring themes of survival and identity in France.,2014,August,Docuseries,,2
s639,Movie,The Secret Rebellion 639,Raj Khan,"Hana Nair, Aisha Kumar, David Khan, David Silva, Tom Costa",South Korea,27-08-2021,2020,R,173 min,"Sci-Fi & Fantasy, Thrillers",A gripping movie exploring themes of survival and identity in South Korea.,2021,August,Sci-Fi & Fantasy,173,
