show_id,type,title,director,cast,country,date_added,release_year,rating,duration,listed_in,description,year_added,month_added,primary_genre,duration_minutes,seasons
s275,TV Show,The Hidden Journey 275,Unknown,"Wei Smith, Maria Rossi, Yuki Nair, Fatima Patel, Sara Rossi, Raj Costa, Tom Park",India,19-04-2011,2011,TV-MA,3 Seasons,"Anime Series, Docuseries",A gripping tv show exploring themes of survival and identity in India.,2011,April,Anime Series,,3
s276,Movie,The Silent Legacy 276,Tom Tanaka,"Elena Costa, Maria Johnson, Yuki Lee, Aisha Müller, David Smith, John Patel, Priya Kumar",India,25-06-2022,2021,TV-MA,149 min,Romantic Movies,A gripping movie exploring themes of survival and identity in India.,2022,June,Romantic Movies,149,
s277,Movie,The Last Promise 277,Unknown,"Elena Patel, Fatima Kumar, Sara Tanaka, Priya Kumar, Hana Müller, Elena Nair",United States,07-01-2019,2019,PG,83 min,"Documentaries, Comedies",A gripping movie exploring themes of survival and identity in United States.,2019,January,Documentaries,83,
s278,Movie,The Last Horizon 278,Fatima Patel,"Priya Nair, Yuki Smith, Hana Patel",Turkey,02-11-2022,2019,TV-14,116 min,"Thrillers, Romantic Movies, Dramas",A gripping movie exploring themes of survival and identity in Turkey.,2022,November,Thrillers,116,
s279,Movie,The Eternal Rebellion 279,Carlos Johnson,"Aisha Park, John Costa, Sara Müller, Min Park",India,08-12-2026,2025,TV-PG,138 min,"Documentaries, Sci-Fi & Fantasy",A gripping movie exploring themes of survival and identity in India.,2026,December,Documentaries,138,
s280,Movie,The Eternal Rebellion 280,David Müller,"Min Lee, David Patel, David Nair, Sara Silva",France,06-02-2010,2010,TV-14,171 min,Independent Movies,A gripping movie exploring themes of survival and identity in France.,2010,February,Independent Movies,171,
s281,TV Show,The Broken Kingdom 281,Unknown,"Min Rossi, Tom Kumar, Anil Khan, Raj Patel, Maria Khan",Brazil,11-12-2025,2020,NR,4 Seasons,"Reality TV, Docuseries",A gripping tv show exploring themes of survival and identity in Brazil.,2025,December,Reality TV,,4
s282,Movie,The Forgotten Rebellion 282,Unknown,"Sara Garcia, Maria Khan, Sara Johnson, Carlos Tanaka, Fatima Costa, Yuki Smith",India,01-06-2019,2019,R,168 min,"Horror Movies, Independent Movies, Action & Adventure",A gripping movie exploring themes of survival and identity in India.,2019,June,Horror Movies,168,
s283,TV Show,The Lost Memory Chronicles 283,Unknown,"John Johnson, Yuki Kumar, Tom Smith, Anil Costa, David Lee, Aisha Silva, John Nair",United States,07-10-2024,2022,R,2 Seasons,"Crime TV Shows, Anime Series",A gripping tv show exploring themes of survival and identity in United States.,2024,October,Crime TV Shows,,2
s284,Movie,The Silent City 284,Unknown,"Maria Lee, Carlos Garcia, Anil Müller, Tom Rossi, Priya Tanaka, Aisha Khan, Tom Garcia",United Kingdom,01-10-2021,2019,TV-14,151 min,"Thrillers, Dramas, Horror Movies",A gripping movie exploring themes of survival and identity in United Kingdom.,2021,October,Thrillers,151,
s285,Movie,The Last Dreams 285,Tom Patel,"Maria Costa, Maria Rossi, Hana Rossi, Tom Müller, Hana Patel, Carlos Tanaka",Mexico,16-02-2023,2020,TV-PG,143 min,"Dramas, Independent Movies, Thrillers",A gripping movie exploring themes of survival and identity in Mexico.,2023,February,Dramas,143,
s286,Movie,The Silent Promise 286,Sara Tanaka,"Sara Johnson, Raj Costa, Yuki Garcia, Sara Johnson, Min Johnson",United States,11-07-2026,2022,TV-G,157 min,"Comedies, Sci-Fi & Fantasy, Thrillers",A gripping movie exploring themes of survival and identity in United States.,2026,July,Comedies,157,
s287,Movie,The Dark Empire 287,Priya Smith,"Carlos Johnson, Maria Nair, Yuki Kumar",Japan,27-01-2021,2018,TV-PG,99 min,Romantic Movies,A gripping movie exploring themes of survival and identity in Japan.,2021,January,Romantic Movies,99,
s288,Movie,The Lost Journey 288,Hana Tanaka,"Fatima Patel, Elena Johnson, Maria Park, Raj Silva, Anil Khan, Wei Kumar, Yuki Tanaka",United States,10-02-2022,2017,TV-MA,127 min,"Dramas, Romantic Movies",A gripping movie exploring themes of survival and identity in United States.,2022,February,Dramas,127,
s289,Movie,The Lost Horizon 289,Unknown,"Raj Khan, Tom Tanaka, Tom Patel",United Kingdom,02-05-2022,2018,TV-14,129 min,"Dramas, Comedies, Thrillers",A gripping movie exploring themes of survival and identity in United Kingdom.,2022,May,Dramas,129,
s290,Movie,The Lost Legacy 290,Min Patel,"Anil Tanaka, Yuki Lee, Elena Silva",France,16-06-2024,2022,TV-MA,180 min,"Independent Movies, Comedies, Action & Adventure",A gripping movie exploring themes of survival and identity in France.,2024,June,Independent Movies,180,
s291,Movie,The Silent City 291,Fatima Costa,"Fatima Silva, Raj Patel, Fatima Tanaka",Spain,12-01-2023,2022,PG-13,157 min,"Romantic Movies, Horror Movies",A gripping movie exploring themes of survival and identity in Spain.,2023,January,Romantic Movies,157,
s292,TV Show,The Broken Legacy 292,Unknown,"Carlos Johnson, Maria Silva, Yuki Johnson, David Rossi, Maria Tanaka, Maria Johnson",United Kingdom,22-07-2026,2024,TV-MA,3 Seasons,"TV Action & Adventure, Reality TV, Kids' TV",A gripping tv show exploring themes of survival and identity in United Kingdom.,2026,July,TV Action & Adventure,,3
s293,Movie,The Hidden City 293,Wei Lee,"John Garcia, David Nair, Maria Park",United States,23-05-2013,2012,TV-Y7,160 min,"Action & Adventure, Thrillers, Sci-Fi & Fantasy",A gripping movie exploring themes of survival and identity in United States.,2013,May,Action & Adventure,160,
s294,Movie,The Eternal Shadows 294,John Garcia,"Raj Costa, Fatima Johnson, Carlos Johnson, Carlos Tanaka",United States,14-07-2021,2020,TV-MA,108 min,"Horror Movies, Action & Adventure",A gripping movie exploring themes of survival and identity in United States.,2021,July,Horror Movies,108,
s295,Movie,The Endless Shadows 295,Elena Park,"Wei Nair, Tom Rossi, Elena Garcia, Wei Tanaka, Carlos Kumar",France,03-06-2023,2022,NR,158 min,"Action & Adventure, Independent Movies",A gripping movie exploring themes of survival and identity in France.,2023,June,Action & Adventure,158,
s296,TV Show,The Hidden Journey 296,Unknown,"Min Nair, Elena Park, David Nair, Min Tanaka",United States,14-05-2025,2025,TV-G,4 Seasons,TV Comedies,A gripping tv show exploring themes of survival and identity in United States.,2025,May,TV Comedies,,4
s297,Movie,The Endless Storm 297,Min Rossi,"Carlos Patel, Tom Park, Anil Patel",United States,27-12-2023,2021,R,118 min,"Romantic Movies, Thrillers, Dramas",A gripping movie exploring themes of survival and identity in United States.,2023,December,Romantic Movies,118,
s298,Movie,The Lost Storm 298,Yuki Rossi,"Aisha Khan, Anil Park, Maria Rossi, Min Smith",United States,02-11-2018,2018,TV-MA,94 min,"Children & Family Movies, Thrillers",A gripping movie exploring themes of survival and identity in United States.,2018,November,Children & Family Movies,94,
s299,Movie,The Eternal Empire 299,Min Kumar,"Min Johnson, Hana Rossi, Priya Khan, David Park",Turkey,06-02-2016,2013,TV-MA,169 min,"Independent Movies, Action & Adventure, Thrillers",A gripping movie exploring themes of survival and identity in Turkey.,2016,February,Independent Movies,169,
s300,Movie,The Silent Legacy 300,Unknown,"Sara Smith, Tom Park, Wei Silva, Tom Kumar, Wei Lee, Maria Garcia",Turkey,23-03-2017,2017,PG,163 min,Comedies,A gripping movie exploring themes of survival and identity in Turkey.,2017,March,Comedies,163,
s301,TV Show,The Wild Shadows Chronicles 301,Unknown,"John Garcia, Hana Kumar, Fatima Kumar, Min Rossi",South Korea,02-12-2020,2020,PG,7 Seasons,"Anime Series, Docuseries",A gripping tv show exploring themes of survival and identity in South Korea.,2020,December,Anime Series,,7
s302,TV Show,The Silent Shadows 302,Unknown,"Priya Johnson, Raj Tanaka, Fatima Johnson, Hana Kumar, Wei Garcia, Anil Müller",Spain,16-10-2018,2014,R,4 Seasons,"Anime Series, TV Mysteries, TV Action & Adventure",A gripping tv show exploring themes of survival and identity in Spain.,2018,October,Anime Series,,4
s303,Movie,The Dark Rebellion 303,Unknown,"Wei Garcia, Yuki Johnson, Wei Rossi, Sara Kumar, Priya Costa, Yuki Lee",United States,19-11-2023,2022,R,177 min,"Horror Movies, Romantic Movies, Comedies",A gripping movie exploring themes of survival and identity in United States.,2023,November,Horror Movies,177,
s304,Movie,The Forgotten Empire 304,Unknown,"David Patel, Aisha Patel, Hana Park, Hana Johnson, Anil Smith",India,25-02-2017,2015,TV-14,124 min,"Comedies, Horror Movies, Children & Family Movies",A gripping movie exploring themes of survival and identity in India.,2017,February,Comedies,124,
s305,TV Show,The Hidden Promise 305,Unknown,"David Khan, Sara Garcia, Elena Patel, Elena Rossi, Wei Johnson, Carlos Park, Yuki Tanaka",Italy,17-11-2024,2023,TV-PG,2 Seasons,"TV Mysteries, Docuseries, TV Action & Adventure",A gripping tv show exploring themes of survival and identity in Italy.,2024,November,TV Mysteries,,2
s306,TV Show,The Wild City 306,Unknown,"Sara Patel, Hana Kumar, Hana Park, Yuki Khan, Priya Khan",Mexico,26-11-2020,2019,R,2 Seasons,"TV Action & Adventure, TV Mysteries, TV Dramas",A gripping tv show exploring themes of survival and identity in Mexico.,2020,November,TV Action & Adventure,,2
s307,TV Show,The Silent Memory 307,Unknown,"Hana Lee, David Müller, Elena Rossi, Anil Müller",Spain,04-01-2024,2023,TV-Y,6 Seasons,"TV Mysteries, TV Dramas",A gripping tv show exploring themes of survival and identity in Spain.,2024,January,TV Mysteries,,6
s308,Movie,The Endless Memory 308,Anil Nair,"Yuki Johnson, David Patel, Raj Tanaka, David Costa, Sara Smith, Maria Khan, Raj Lee",United States,28-08-2023,2022,TV-14,138 min,"Children & Family Movies, Thrillers",A gripping movie exploring themes of survival and identity in United States.,2023,August,Children & Family Movies,138,
s309,Movie,The Wild Dreams 309,Yuki Park,"Anil Khan, Aisha Smith, Elena Tanaka, Sara Rossi, Yuki Tanaka",India,27-09-2026,2022,TV-PG,91 min,"Sci-Fi & Fantasy, Thrillers, Action & Adventure",A gripping movie exploring themes of survival and identity in India.,2026,September,Sci-Fi & Fantasy,91,
s310,Movie,The Lost Storm 310,Min Patel,"Elena Patel, Maria Tanaka, David Rossi",United Kingdom,04-03-2010,2009,TV-MA,117 min,Documentaries,A gripping movie exploring themes of survival and identity in United Kingdom.,2010,March,Documentaries,117,
s311,Movie,The Eternal Journey 311,Maria Tanaka,"Min Silva, John Kumar, Yuki Kumar",Spain,25-05-2021,2020,TV-Y,111 min,Comedies,A gripping movie exploring themes of survival and identity in Spain.,2021,May,Comedies,111,
s312,Movie,The Silent Legacy 312,Yuki Kumar,"Yuki Müller, Hana Lee, Hana Tanaka, Yuki Khan, David Costa, Min Müller, John Khan",United Kingdom,11-02-2015,2010,TV-MA,129 min,Comedies,A gripping movie exploring themes of survival and identity in United Kingdom.,2015,February,Comedies,129,
s313,Movie,The Secret Shadows 313,Sara Patel,"Fatima Garcia, Yuki Johnson, Carlos Garcia, Priya Khan, David Patel",Canada,04-05-2018,2017,TV-PG,71 min,"Independent Movies, Sci-Fi & Fantasy, Comedies",A gripping movie exploring themes of survival and identity in Canada.,2018,May,Independent Movies,71,
s314,TV Show,The Dark Kingdom 314,Unknown,"Priya Silva, Tom Garcia, Min Johnson",Australia,01-03-2023,2022,TV-MA,8 Season,TV Action & Adventure,A gripping tv show exploring themes of survival and identity in Australia.,2023,March,TV Action & Adventure,,8
s315,Movie,The Endless Legacy 315,Unknown,"John Rossi, Yuki Müller, Min Rossi, Carlos Tanaka, Maria Nair, Fatima Lee",Japan,25-12-2026,2024,R,155 min,"Comedies, Children & Family Movies, Action & Adventure",A gripping movie exploring themes of survival and identity in Japan.,2026,December,Comedies,155,
s316,Movie,The Lost Horizon 316,Unknown,"John Lee, Elena Rossi, Wei Khan, Sara Johnson, Maria Patel, John Silva",United States,22-12-2021,2020,TV-MA,112 min,"Children & Family Movies, Sci-Fi & Fantasy",A gripping movie exploring themes of survival and identity in United States.,2021,December,Children & Family Movies,112,
s317,Movie,The Endless Journey 317,Tom Johnson,"Carlos Johnson, Carlos Patel, Wei Rossi, Tom Smith, David Tanaka, Aisha Costa",United States,18-06-2019,2018,TV-PG,153 min,Horror Movies,A gripping movie exploring themes of survival and identity in United States.,2019,June,Horror Movies,153,
s318,Movie,The Forgotten Rebellion 318,Priya Park,"Elena Smith, Min Lee, John Nair, Min Garcia, Yuki Silva, Priya Johnson, John Müller",South Korea,18-06-2020,2019,PG,158 min,Action & Adventure,A gripping movie exploring themes of survival and identity in South Korea.,2020,June,Action & Adventure,158,
s319,Movie,The Dark Dreams 319,Raj Costa,"Maria Rossi, Yuki Silva, Min Tanaka, Hana Müller",United States,16-06-2026,2024,TV-PG,152 min,"Dramas, Comedies, Documentaries",A gripping movie exploring themes of survival and identity in United States.,2026,June,Dramas,152,
s320,TV Show,The Endless Empire 320,Unknown,"Tom Nair, Maria Nair, Yuki Kumar, Sara Patel, Anil Kumar, Sara Smith, Yuki Nair",United States,26-10-2026,2021,TV-Y7,5 Seasons,"Romantic TV Shows, TV Comedies, TV Dramas",A gripping tv show exploring themes of survival and identity in United States.,2026,October,Romantic TV Shows,,5
s321,Movie,The Endless Legacy 321,Unknown,"Elena Garcia, Hana Patel, Tom Nair, Sara Nair",United States,13-10-2026,2023,TV-PG,150 min,"Thrillers, Sci-Fi & Fantasy",A gripping movie exploring themes of survival and identity in United States.,2026,October,Thrillers,150,
s322,Movie,The Last Legacy 322,Unknown,"Maria Park, Elena Müller, Aisha Garcia",United States,28-05-2023,2022,TV-Y,155 min,Action & Adventure,A gripping movie exploring themes of survival and identity in United States.,2023,May,Action & Adventure,155,
s323,Movie,The Wild Dreams 323,Min Patel,"Min Silva, Sara Tanaka, Wei Silva, Raj Johnson, Elena Nair, Carlos Park",United States,26-11-2026,2021,TV-14,123 min,"Sci-Fi & Fantasy, Thrillers",A gripping movie exploring themes of survival and identity in United States.,2026,November,Sci-Fi & Fantasy,123,
s324,TV Show,The Lost Memory 324,Unknown,"Sara Smith, Elena Park, Priya Garcia, Fatima Rossi, Priya Patel, Priya Tanaka",Spain,18-07-2022,2021,TV-14,6 Season,TV Mysteries,A gripping tv show exploring themes of survival and identity in Spain.,2022,July,TV Mysteries,,6
s325,TV Show,The Forgotten Empire Chronicles 325,Unknown,"Min Patel, Elena Johnson, David Silva, Sara Costa, Yuki Khan, Wei Kumar",Mexico,03-11-2026,2022,TV-MA,5 Season,"Reality TV, TV Dramas",A gripping tv show exploring themes of survival and identity in Mexico.,2026,November,Reality TV,,5
s326,Movie,The Silent Journey 326,Anil Müller,"Raj Khan, Elena Smith, Maria Patel, Priya Nair, Fatima Khan",United Kingdom,24-05-2021,2021,PG-13,170 min,"Horror Movies, Dramas, Children & Family Movies",A gripping movie exploring themes of survival and identity in United Kingdom.,2021,May,Horror Movies,170,
s327,TV Show,The Silent Promise 327,Unknown,"Sara Costa, Wei Khan, Carlos Rossi, Wei Costa, Anil Lee, Priya Garcia",United States,09-05-2014,2013,R,5 Season,"TV Comedies, Crime TV Shows, Reality TV",A gripping tv show exploring themes of survival and identity in United States.,2014,May,TV Comedies,,5
s328,Movie,The Eternal Empire 328,Wei Tanaka,"Sara Kumar, Fatima Costa, John Kumar, Wei Rossi, Tom Rossi, Yuki Rossi, Carlos Silva",Canada,25-07-2021,2017,TV-14,119 min,Children & Family Movies,A gripping movie exploring themes of survival and identity in Canada.,2021,July,Children & Family Movies,119,
s329,TV Show,The Last Dreams 329,Unknown,"Tom Müller, David Patel, Anil Smith, Sara Nair, Aisha Johnson, Fatima Lee",United States,16-07-2023,2022,TV-14,5 Seasons,"TV Action & Adventure, TV Dramas, Docuseries",A gripping tv show exploring themes of survival and identity in United States.,2023,July,TV Action & Adventure,,5
s330,Movie,The Golden Dreams 330,Wei Lee,"Raj Müller, Raj Nair, Priya Kumar, Aisha Smith, John Müller, Min Lee, Carlos Park",South Korea,19-11-2012,2009,TV-MA,120 min,"Documentaries, Sci-Fi & Fantasy",A gripping movie exploring themes of survival and identity in South Korea.,2012,November,Documentaries,120,
s331,Movie,The Lost Legacy 331,John Park,"Priya Nair, Maria Silva, Wei Smith",South Korea,02-04-2023,2021,PG-13,73 min,"Comedies, Dramas, Documentaries",A gripping movie exploring themes of survival and identity in South Korea.,2023,April,Comedies,73,
s332,Movie,The Golden Legacy 332,Unknown,"Priya Khan, Anil Silva, Tom Lee, Anil Khan",Japan,10-05-2025,2021,TV-14,129 min,"Comedies, Children & Family Movies, Horror Movies",A gripping movie exploring themes of survival and identity in Japan.,2025,May,Comedies,129,
s333,Movie,The Last Journey 333,Elena Smith,"Aisha Tanaka, John Rossi, Fatima Smith, Anil Smith",India,03-08-2012,2012,PG,132 min,Sci-Fi & Fantasy,A gripping movie exploring themes of survival and identity in India.,2012,August,Sci-Fi & Fantasy,132,
s334,Movie,The Dark Rebellion 334,Unknown,"Anil Müller, Tom Khan, Maria Park",United States,09-12-2025,2022,TV-Y,169 min,"Dramas, Children & Family Movies",A gripping movie exploring themes of survival and identity in United States.,2025,December,Dramas,169,
s335,Movie,The Hidden Memory 335,Priya Patel,"Raj Silva, Elena Smith, Sara Lee, Yuki Silva",Canada,01-10-2019,2018,TV-MA,135 min,"Children & Family Movies, Sci-Fi & Fantasy, Thrillers",A gripping movie exploring themes of survival and identity in Canada.,2019,October,Children & Family Movies,135,
s336,Movie,The Eternal Empire 336,Unknown,"Wei Patel, Anil Silva, Hana Khan, Tom Smith",India,03-11-2020,2019,PG-13,116 min,"Romantic Movies, Comedies, Children & Family Movies",A gripping movie exploring themes of survival and identity in India.,2020,November,Romantic Movies,116,
s337,Movie,The Wild Promise 337,Unknown,"Carlos Rossi, Tom Smith, Yuki Rossi",United States,16-06-2022,2021,TV-G,80 min,"Children & Family Movies, Documentaries, Action & Adventure",A gripping movie exploring themes of survival and identity in United States.,2022,June,Children & Family Movies,80,
s338,Movie,The Forgotten Kingdom 338,Anil Silva,"Hana Costa, Min Müller, Maria Park",Spain,02-01-2021,2016,TV-MA,113 min,Romantic Movies,A gripping movie exploring themes of survival and identity in Spain.,2021,January,Romantic Movies,113,
s339,Movie,The Hidden Dreams 339,Elena Johnson,"Carlos Park, Maria Kumar, Wei Müller",Spain,02-02-2022,2019,PG-13,164 min,Children & Family Movies,A gripping movie exploring themes of survival and identity in Spain.,2022,February,Children & Family Movies,164,
s340,TV Show,The Broken Shadows Chronicles 340,Unknown,"Carlos Smith, Hana Silva, David Costa, Tom Lee, John Müller, Maria Lee",United States,15-02-2022,2019,TV-MA,3 Seasons,TV Comedies,A gripping tv show exploring themes of survival and identity in United States.,2022,February,TV Comedies,,3
s341,TV Show,The Last Memory 341,Unknown,"Aisha Garcia, Sara Patel, Wei Rossi, Carlos Johnson",Spain,06-10-2018,2017,TV-MA,6 Seasons,Docuseries,A gripping tv show exploring themes of survival and identity in Spain.,2018,October,Docuseries,,6
s342,Movie,The Silent Kingdom 342,Priya Kumar,"Wei Smith, Yuki Silva, Elena Park",Germany,13-10-2025,2024,PG,169 min,Dramas,A gripping movie exploring themes of survival and identity in Germany.,2025,October,Dramas,169,
s343,TV Show,The Wild Horizon 343,Unknown,"Anil Johnson, Wei Park, Elena Johnson, Priya Müller, Yuki Lee, Aisha Kumar, Carlos Tanaka",South Korea,21-03-2011,2011,TV-MA,5 Seasons,"Kids' TV, Crime TV Shows",A gripping tv show exploring themes of survival and identity in South Korea.,2011,March,Kids' TV,,5
s344,Movie,The Silent Legacy 344,Hana Khan,"Hana Smith, Maria Müller, Elena Rossi",Unknown,12-10-2023,2019,TV-PG,180 min,"Independent Movies, Documentaries, Children & Family Movies",A gripping movie exploring themes of survival and identity in India.,2023,October,Independent Movies,180,
s345,Movie,The Secret Journey 345,David Johnson,"Anil Smith, Anil Patel, Wei Garcia, Raj Rossi, John Smith, Carlos Park",India,02-11-2021,2020,TV-Y,76 min,"Romantic Movies, Horror Movies, Documentaries",A gripping movie exploring themes of survival and identity in India.,2021,November,Romantic Movies,76,
s346,Movie,The Secret Journey 346,John Lee,"John Tanaka, Aisha Nair, Hana Silva, Carlos Smith",Germany,11-10-2022,2021,TV-14,123 min,Romantic Movies,A gripping movie exploring themes of survival and identity in Germany.,2022,October,Romantic Movies,123,
s347,Movie,The Lost Journey 347,Min Garcia,"Sara Garcia, Min Park, Hana Müller, Sara Khan, Hana Lee, Maria Kumar",India,02-08-2022,2021,R,125 min,Documentaries,A gripping movie exploring themes of survival and identity in India.,2022,August,Documentaries,125,
s348,Movie,The Wild Promise 348,Unknown,"Carlos Khan, Wei Costa, Wei Johnson, Carlos Smith, Aisha Nair",South Korea,09-01-2017,2015,TV-14,87 min,Children & Family Movies,A gripping movie exploring themes of survival and identity in South Korea.,2017,January,Children & Family Movies,87,
s349,Movie,The Secret Empire 349,Carlos Tanaka,"Aisha Johnson, Carlos Johnson, Maria Johnson, Raj Silva, Anil Kumar",India,19-04-2016,2016,TV-MA,130 min,"Horror Movies, Dramas",A gripping movie exploring themes of survival and identity in India.,2016,April,Horror Movies,130,
s350,TV Show,The Golden Legacy 350,Unknown,"Carlos Smith, Raj Park, Aisha Tanaka, Maria Lee, Yuki Tanaka, Priya Kumar",Canada,02-09-2025,2025,TV-MA,7 Seasons,"TV Comedies, Anime Series",A gripping tv show exploring themes of survival and identity in Canada.,2025,September,TV Comedies,,7
s351,TV Show,The Dark Storm Chronicles 351,Unknown,"Sara Müller, Min Park, Raj Nair, Priya Silva",Nigeria,15-12-2022,2020,PG,1 Seasons,"Crime TV Shows, TV Action & Adventure",A gripping tv show exploring themes of survival and identity in Nigeria.,2022,December,Crime TV Shows,,1
s352,Movie,The Last Rebellion 352,Hana Costa,"David Park, Anil Patel, Sara Kumar",Egypt,10-01-2024,2023,TV-MA,124 min,"Sci-Fi & Fantasy, Independent Movies",A gripping movie exploring themes of survival and identity in Egypt.,2024,January,Sci-Fi & Fantasy,124,
s353,Movie,The Forgotten Empire 353,Priya Patel,"Maria Lee, Carlos Patel, John Müller, Elena Park",United Kingdom,15-06-2018,2017,TV-14,149 min,Romantic Movies,A gripping movie exploring themes of survival and identity in United Kingdom.,2018,June,Romantic Movies,149,
s354,Movie,The Forgotten City 354,Fatima Patel,"Fatima Kumar, Priya Lee, Sara Rossi, Elena Patel, John Rossi, Yuki Rossi",Japan,25-04-2017,2017,R,165 min,Romantic Movies,A gripping movie exploring themes of survival and identity in Japan.,2017,April,Romantic Movies,165,
s355,Movie,The Golden Horizon 355,Min Smith,"Tom Garcia, Yuki Smith, John Garcia",United States,23-11-2026,2023,TV-MA,173 min,Documentaries,A gripping movie exploring themes of survival and identity in United States.,2026,November,Documentaries,173,
s356,Movie,The Broken Storm 356,Raj Khan,"Maria Rossi, Sara Silva, Min Park, Raj Khan, Hana Smith, Raj Nair",Spain,05-12-2026,2022,TV-14,133 min,Documentaries,A gripping movie exploring themes of survival and identity in Spain.,2026,December,Documentaries,133,
s357,Movie,The Hidden Legacy 357,Min Rossi,"Maria Costa, Yuki Garcia, Fatima Tanaka, Elena Lee, Yuki Costa",United States,11-11-2024,2023,TV-MA,122 min,"Romantic Movies, Sci-Fi & Fantasy, Children & Family Movies",A gripping movie exploring themes of survival and identity in United States.,2024,November,Romantic Movies,122,
s358,TV Show,The Secret Dreams 358,Unknown,"Wei Nair, Maria Garcia, Carlos Smith, Anil Lee",France,10-06-2025,2022,PG,8 Seasons,"Crime TV Shows, Reality TV, Docuseries",A gripping tv show exploring themes of survival and identity in France.,2025,June,Crime TV Shows,,8
s359,Movie,The Hidden Empire 359,Unknown,"Wei Patel, Yuki Smith, Raj Silva, Elena Costa, Maria Rossi, David Garcia",United States,06-06-2024,2022,TV-14,96 min,"Dramas, Romantic Movies, Independent Movies",A gripping movie exploring themes of survival and identity in United States.,2024,June,Dramas,96,
s360,Movie,The Dark Horizon 360,Maria Costa,"Min Lee, John Park, Elena Kumar, Maria Müller, John Khan, Raj Silva, Carlos Rossi",Brazil,17-09-2021,2020,TV-14,112 min,"Horror Movies, Children & Family Movies, Sci-Fi & Fantasy",A gripping movie exploring themes of survival and identity in Brazil.,2021,September,Horror Movies,112,
s361,Movie,The Endless Kingdom 361,Fatima Tanaka,"Priya Patel, Min Müller, Priya Patel",Australia,02-06-2025,2023,TV-G,147 min,"Documentaries, Independent Movies, Sci-Fi & Fantasy",A gripping movie exploring themes of survival and identity in Australia.,2025,June,Documentaries,147,
s362,Movie,The Endless Promise 362,Aisha Lee,"Sara Kumar, Yuki Lee, Sara Khan, Min Nair, Priya Tanaka, Min Park",United States,11-08-2021,2019,TV-MA,147 min,"Independent Movies, Dramas, Romantic Movies",A gripping movie exploring themes of survival and identity in United States.,2021,August,Independent Movies,147,
s363,TV Show,The Secret Empire 363,Unknown,"Priya Garcia, Hana Khan, Elena Nair, David Smith, Tom Smith, Raj Silva, Fatima Silva",United States,06-05-2021,2021,TV-14,7 Seasons,TV Mysteries,A gripping tv show exploring themes of survival and identity in United States.,2021,May,TV Mysteries,,7
s364,TV Show,The Golden Dreams 364,Unknown,"Elena Kumar, Yuki Nair, Yuki Rossi, Min Tanaka, Raj Costa",France,25-10-2017,2016,TV-G,3 Seasons,TV Action & Adventure,A gripping tv show exploring themes of survival and identity in France.,2017,October,TV Action & Adventure,,3
s365,Movie,The Secret Journey 365,Elena Park,"Raj Smith, Fatima Rossi, Priya Johnson, Sara Johnson",United States,27-11-2022,2021,PG,151 min,"Comedies, Horror Movies",A gripping movie exploring themes of survival and identity in United States.,2022,November,Comedies,151,
