show_id,type,title,director,cast,country,date_added,release_year,rating,duration,listed_in,description,year_added,month_added,primary_genre,duration_minutes,seasons
s912,Movie,The Forgotten Empire 912,John Garcia,"Yuki Costa, Maria Costa, Aisha Silva, Anil Silva",United Kingdom,20-10-2009,2008,TV-MA,171 min,Action & Adventure,A gripping movie exploring themes of survival and identity in United Kingdom.,2009,October,Action & Adventure,171,
s913,Movie,The Broken Storm 913,Unknown,"Raj Müller, Min Garcia, Hana Khan, Carlos Patel, Carlos Lee, Sara Müller",Canada,18-01-2025,2024,TV-MA,130 min,Thrillers,A gripping movie exploring themes of survival and identity in Canada.,2025,January,Thrillers,130,
s914,Movie,The Silent Rebellion 914,Sara Silva,"Maria Park, Aisha Lee, Raj Patel",United States,22-03-2019,2016,TV-PG,141 min,Horror Movies,A gripping movie exploring themes of survival and identity in United States.,2019,March,Horror Movies,141,
s915,Movie,The Eternal Memory 915,Unknown,"Tom Johnson, Tom Lee, Aisha Müller, Priya Nair, Hana Kumar, Elena Costa, Aisha Smith",India,25-10-2024,2021,TV-14,115 min,"Action & Adventure, Thrillers, Horror Movies",A gripping movie exploring themes of survival and identity in India.,2024,October,Action & Adventure,115,
s916,Movie,The Hidden Legacy 916,Hana Costa,"Tom Patel, Maria Tanaka, Yuki Nair, Fatima Müller, Anil Nair",United States,25-03-2019,2014,PG-13,94 min,"Romantic Movies, Sci-Fi & Fantasy, Comedies",A gripping movie exploring themes of survival and identity in United States.,2019,March,Romantic Movies,94,
s917,Movie,The Forgotten City 917,Unknown,"Tom Smith, Anil Smith, Tom Patel, Hana Smith, Priya Müller, Hana Nair",United States,25-08-2014,2012,R,98 min,Dramas,A gripping movie exploring themes of survival and identity in United States.,2014,August,Dramas,98,
s918,TV Show,The Secret Memory 918,Unknown,"Priya Nair, David Kumar, Min Silva, Wei Nair, Hana Nair",United States,02-01-2019,2019,R,2 Seasons,"TV Dramas, Docuseries, TV Comedies",A gripping tv show exploring themes of survival and identity in United States.,2019,January,TV Dramas,,2
s919,Movie,The Silent Shadows 919,Fatima Khan,"Elena Rossi, Min Johnson, Yuki Silva",United States,21-07-2022,2018,TV-14,88 min,Romantic Movies,A gripping movie exploring themes of survival and identity in United States.,2022,July,Romantic Movies,88,
s920,Movie,The Eternal Storm 920,Sara Kumar,"Priya Park, Elena Park, Elena Silva, Anil Garcia, Priya Costa, Fatima Kumar, Tom Patel",India,15-12-2016,2016,TV-MA,87 min,"Thrillers, Sci-Fi & Fantasy, Action & Adventure",A gripping movie exploring themes of survival and identity in India.,2016,December,Thrillers,87,
s921,TV Show,The Wild Horizon 921,Unknown,"Priya Garcia, David Lee, Wei Tanaka, Sara Silva",Canada,03-05-2026,2025,TV-14,4 Seasons,Anime Series,A gripping tv show exploring themes of survival and identity in Canada.,2026,May,Anime Series,,4
s922,Movie,The Secret Promise 922,Unknown,"Raj Silva, John Tanaka, Aisha Tanaka, David Garcia",United States,01-08-2016,2016,R,96 min,Comedies,A gripping movie exploring themes of survival and identity in United States.,2016,August,Comedies,96,
s923,Movie,The Wild Shadows 923,Priya Müller,"Yuki Khan, Fatima Johnson, Anil Park, Wei Nair, David Kumar, Maria Nair, Tom Khan",United Kingdom,19-09-2025,2025,R,114 min,"Comedies, Documentaries",A gripping movie exploring themes of survival and identity in United Kingdom.,2025,September,Comedies,114,
s924,Movie,The Secret Memory 924,Fatima Nair,"Tom Rossi, John Garcia, Min Park",Mexico,14-02-2023,2018,TV-Y,105 min,"Dramas, Documentaries",A gripping movie exploring themes of survival and identity in Mexico.,2023,February,Dramas,105,
s925,TV Show,The Endless Legacy 925,Unknown,"Elena Nair, Wei Smith, Hana Khan",United States,06-09-2020,2019,PG-13,3 Seasons,Crime TV Shows,A gripping tv show exploring themes of survival and identity in United States.,2020,September,Crime TV Shows,,3
s926,Movie,The Lost Journey 926,Carlos Nair,"Carlos Smith, Wei Patel, David Silva, Raj Lee, Carlos Johnson, Min Park, Raj Rossi",United States,18-10-2018,2016,TV-14,113 min,"Children & Family Movies, Sci-Fi & Fantasy, Documentaries",A gripping movie exploring themes of survival and identity in United States.,2018,October,Children & Family Movies,113,
s927,TV Show,The Silent Shadows Chronicles 927,Unknown,"Tom Nair, Elena Tanaka, Tom Patel",India,24-09-2022,2021,TV-Y,7 Seasons,"TV Comedies, Anime Series, Reality TV",A gripping tv show exploring themes of survival and identity in India.,2022,September,TV Comedies,,7
s928,Movie,The Eternal City 928,Unknown,"Wei Tanaka, Sara Lee, Wei Smith, Tom Müller",South Korea,25-06-2016,2015,TV-14,70 min,"Independent Movies, Action & Adventure",A gripping movie exploring themes of survival and identity in South Korea.,2016,June,Independent Movies,70,
s929,Movie,The Forgotten Shadows 929,Maria Park,"Wei Smith, Maria Lee, Tom Rossi",France,25-01-2023,2021,TV-MA,112 min,"Children & Family Movies, Comedies, Horror Movies",A gripping movie exploring themes of survival and identity in France.,2023,January,Children & Family Movies,112,
s930,Movie,The Golden Memory 930,Yuki Costa,"Raj Garcia, Maria Kumar, David Costa, Anil Johnson, Carlos Müller, Aisha Park, Fatima Patel",India,19-09-2016,2014,TV-Y7,138 min,"Horror Movies, Documentaries, Thrillers",A gripping movie exploring themes of survival and identity in India.,2016,September,Horror Movies,138,
s931,TV Show,The Broken Storm 931,Unknown,"Min Costa, Anil Park, Min Smith, Sara Garcia, Carlos Patel, Tom Rossi",Brazil,10-03-2025,2025,TV-14,6 Seasons,"TV Comedies, Docuseries, Romantic TV Shows",A gripping tv show exploring themes of survival and identity in Brazil.,2025,March,TV Comedies,,6
s932,Movie,The Silent City 932,Priya Park,"Elena Johnson, Elena Silva, Maria Nair, Aisha Patel, Elena Park, Maria Nair",Spain,06-11-2022,2022,TV-PG,73 min,"Children & Family Movies, Horror Movies, Thrillers",A gripping movie exploring themes of survival and identity in Spain.,2022,November,Children & Family Movies,73,
s933,Movie,The Endless Rebellion 933,Raj Silva,"Carlos Lee, Anil Park, Fatima Kumar, Sara Costa",United Kingdom,19-09-2021,2021,TV-MA,95 min,"Dramas, Independent Movies",A gripping movie exploring themes of survival and identity in United Kingdom.,2021,September,Dramas,95,
s934,TV Show,The Wild Rebellion 934,Unknown,"Fatima Patel, Wei Costa, David Nair, Sara Khan",Unknown,20-12-2021,2020,R,6 Seasons,"TV Dramas, TV Mysteries, TV Comedies",A gripping tv show exploring themes of survival and identity in United States.,2021,December,TV Dramas,,6
s935,Movie,The Broken Storm 935,Yuki Garcia,"Maria Müller, Fatima Costa, Tom Nair, Carlos Nair",Spain,19-08-2020,2019,PG-13,120 min,Action & Adventure,A gripping movie exploring themes of survival and identity in Spain.,2020,August,Action & Adventure,120,
s936,Movie,The Silent Rebellion 936,Unknown,"Wei Patel, David Park, Elena Garcia, David Silva, Wei Johnson",United Kingdom,04-10-2015,2014,TV-Y7,113 min,"Action & Adventure, Horror Movies",A gripping movie exploring themes of survival and identity in United Kingdom.,2015,October,Action & Adventure,113,
s937,Movie,The Golden Rebellion 937,Sara Smith,"John Patel, Tom Lee, Sara Kumar, Elena Patel",South Korea,08-10-2021,2016,TV-MA,158 min,Romantic Movies,A gripping movie exploring themes of survival and identity in South Korea.,2021,October,Romantic Movies,158,
s938,Movie,The Forgotten Promise 938,Carlos Kumar,"Yuki Müller, John Müller, Priya Nair, John Rossi",United States,11-09-2023,2023,TV-Y7,72 min,"Romantic Movies, Children & Family Movies, Horror Movies",A gripping movie exploring themes of survival and identity in United States.,2023,September,Romantic Movies,72,
s939,Movie,The Dark Kingdom 939,Priya Nair,"Hana Silva, Yuki Smith, David Khan, Min Smith, David Nair",United Kingdom,02-03-2013,2013,PG-13,95 min,"Romantic Movies, Documentaries, Horror Movies",A gripping movie exploring themes of survival and identity in United Kingdom.,2013,March,Romantic Movies,95,
s940,Movie,The Silent Empire 940,Hana Nair,"Elena Park, John Tanaka, Aisha Rossi, David Kumar, Raj Johnson, Fatima Nair",United States,07-02-2017,2017,TV-MA,163 min,Romantic Movies,A gripping movie exploring themes of survival and identity in United States.,2017,February,Romantic Movies,163,
s941,Movie,The Silent Kingdom 941,Wei Rossi,"John Park, Elena Patel, Anil Johnson, Maria Costa, Elena Kumar, Fatima Lee",Mexico,26-11-2025,2021,TV-14,83 min,"Comedies, Dramas",A gripping movie exploring themes of survival and identity in Mexico.,2025,November,Comedies,83,
s942,Movie,The Silent Legacy 942,David Patel,"Aisha Kumar, David Nair, Aisha Costa, Min Patel, Min Khan, Yuki Nair",Germany,17-09-2023,2021,TV-Y7,141 min,"Thrillers, Action & Adventure",A gripping movie exploring themes of survival and identity in Germany.,2023,September,Thrillers,141,
s943,Movie,The Hidden Shadows 943,Aisha Lee,"Yuki Garcia, Maria Khan, John Smith, Aisha Lee, Raj Garcia",United States,23-08-2020,2017,TV-MA,113 min,"Romantic Movies, Horror Movies, Sci-Fi & Fantasy",A gripping movie exploring themes of survival and identity in United States.,2020,August,Romantic Movies,113,
s944,Movie,The Broken Shadows 944,Carlos Smith,"Maria Müller, John Costa, David Nair, David Smith",Canada,05-01-2026,2021,TV-MA,172 min,"Romantic Movies, Documentaries",A gripping movie exploring themes of survival and identity in Canada.,2026,January,Romantic Movies,172,
s945,TV Show,The Lost Promise 945,Unknown,"Yuki Khan, Yuki Nair, Tom Silva",United States,11-06-2026,2022,TV-PG,8 Season,"Kids' TV, TV Action & Adventure, Crime TV Shows",A gripping tv show exploring themes of survival and identity in United States.,2026,June,Kids' TV,,8
s946,Movie,The Last Storm 946,Min Park,"Aisha Garcia, Raj Garcia, Sara Nair, Wei Lee, Yuki Tanaka",United States,16-03-2023,2019,TV-PG,178 min,"Documentaries, Thrillers, Children & Family Movies",A gripping movie exploring themes of survival and identity in United States.,2023,March,Documentaries,178,
s947,Movie,The Eternal Shadows 947,John Park,"Hana Nair, Priya Garcia, Hana Johnson, Maria Nair",Mexico,26-04-2023,2018,TV-Y7,174 min,Independent Movies,A gripping movie exploring themes of survival and identity in Mexico.,2023,April,Independent Movies,174,
s948,Movie,The Wild Empire 948,Raj Smith,"Carlos Silva, Fatima Rossi, Wei Tanaka, Min Lee, Raj Patel, Wei Costa, Elena Silva",United States,10-11-2026,2024,R,149 min,Dramas,A gripping movie exploring themes of survival and identity in United States.,2026,November,Dramas,149,
s949,TV Show,The Hidden City 949,Unknown,"Min Lee, Fatima Park, Sara Patel, Fatima Rossi, Maria Silva, Maria Nair",Brazil,22-02-2024,2023,NR,8 Seasons,Romantic TV Shows,A gripping tv show exploring themes of survival and identity in Brazil.,2024,February,Romantic TV Shows,,8
s950,TV Show,The Silent Horizon Chronicles 950,Unknown,"Tom Kumar, Wei Park, Min Smith",United States,20-03-2026,2024,TV-MA,2 Seasons,"Reality TV, Kids' TV",A gripping tv show exploring themes of survival and identity in United States.,2026,March,Reality TV,,2
s951,Movie,The Endless City 951,Hana Johnson,"Wei Nair, Raj Lee, Wei Garcia, Maria Johnson, Hana Park, Aisha Garcia, John Park",Brazil,22-08-2011,2010,TV-14,97 min,Children & Family Movies,A gripping movie exploring themes of survival and identity in Brazil.,2011,August,Children & Family Movies,97,
s952,Movie,The Wild Dreams 952,Maria Tanaka,"David Müller, Sara Park, Carlos Costa, Hana Lee",United States,28-11-2024,2023,TV-PG,144 min,Horror Movies,A gripping movie exploring themes of survival and identity in United States.,2024,November,Horror Movies,144,
s953,Movie,The Lost Empire 953,Tom Khan,"Raj Johnson, David Khan, Fatima Johnson, Elena Johnson",Nigeria,14-05-2024,2022,TV-MA,85 min,"Children & Family Movies, Sci-Fi & Fantasy",A gripping movie exploring themes of survival and identity in Nigeria.,2024,May,Children & Family Movies,85,
s954,Movie,The Wild Promise 954,Wei Rossi,"Wei Kumar, David Tanaka, Min Costa",India,06-02-2026,2024,TV-MA,127 min,"Sci-Fi & Fantasy, Children & Family Movies, Dramas",A gripping movie exploring themes of survival and identity in India.,2026,February,Sci-Fi & Fantasy,127,
s955,Movie,The Broken Legacy 955,Carlos Garcia,"Raj Costa, John Garcia, Sara Silva, Anil Patel",United States,04-12-2020,2016,PG-13,97 min,"Romantic Movies, Action & Adventure",A gripping movie exploring themes of survival and identity in United States.,2020,December,Romantic Movies,97,
s956,Movie,The Golden Kingdom 956,Hana Park,"Sara Garcia, Carlos Müller, Tom Kumar, Anil Tanaka, Raj Khan",United States,02-01-2025,2020,TV-MA,103 min,"Children & Family Movies, Sci-Fi & Fantasy, Independent Movies",A gripping movie exploring themes of survival and identity in United States.,2025,January,Children & Family Movies,103,
s957,Movie,The Lost Journey 957,Sara Nair,"Hana Nair, Priya Kumar, Maria Müller, Wei Costa",United States,21-07-2024,2022,TV-14,80 min,"Sci-Fi & Fantasy, Romantic Movies, Comedies",A gripping movie exploring themes of survival and identity in United States.,2024,July,Sci-Fi & Fantasy,80,
s958,Movie,The Eternal Legacy 958,Elena Khan,"Hana Kumar, Hana Kumar, Aisha Rossi, Priya Tanaka, Elena Smith, John Garcia, Tom Kumar",United States,12-12-2026,2023,PG,154 min,Comedies,A gripping movie exploring themes of survival and identity in United States.,2026,December,Comedies,154,
s959,TV Show,The Silent Shadows 959,Unknown,"Aisha Rossi, Maria Kumar, John Johnson, Priya Smith, John Silva, Tom Smith",India,05-12-2023,2023,R,2 Seasons,TV Comedies,A gripping tv show exploring themes of survival and identity in India.,2023,December,TV Comedies,,2
s960,Movie,The Endless City 960,Unknown,"Min Tanaka, Hana Johnson, Hana Kumar, Yuki Johnson, Hana Silva",United States,20-02-2025,2023,TV-MA,162 min,Children & Family Movies,A gripping movie exploring themes of survival and identity in United States.,2025,February,Children & Family Movies,162,
s961,Movie,The Hidden Journey 961,John Garcia,"Wei Smith, Priya Khan, Raj Costa, Tom Müller, Maria Lee",United States,18-04-2026,2023,TV-PG,71 min,"Action & Adventure, Children & Family Movies, Horror Movies",A gripping movie exploring themes of survival and identity in United States.,2026,April,Action & Adventure,71,
s962,TV Show,The Lost Empire Chronicles 962,Unknown,"Hana Park, Sara Lee, Tom Nair",Mexico,11-11-2024,2023,TV-MA,3 Seasons,"Docuseries, TV Action & Adventure, Crime TV Shows",A gripping tv show exploring themes of survival and identity in Mexico.,2024,November,Docuseries,,3
s963,TV Show,The Dark Rebellion 963,Unknown,"Raj Costa, John Tanaka, Min Smith, Maria Khan, Hana Silva, Sara Patel",Egypt,01-11-2026,2022,TV-MA,4 Seasons,TV Mysteries,A gripping tv show exploring themes of survival and identity in Egypt.,2026,November,TV Mysteries,,4
s964,Movie,The Silent Promise 964,Priya Park,"Raj Garcia, Elena Kumar, Aisha Smith, Sara Johnson",United States,25-05-2017,2017,TV-MA,86 min,Dramas,A gripping movie exploring themes of survival and identity in United States.,2017,May,Dramas,86,
s965,Movie,The Silent Dreams 965,Anil Rossi,"Aisha Silva, Raj Silva, Carlos Garcia",United States,18-04-2021,2020,R,133 min,"Dramas, Action & Adventure",A gripping movie exploring themes of survival and identity in United States.,2021,April,Dramas,133,
s966,Movie,The Last Shadows 966,Wei Nair,"Carlos Park, Yuki Kumar, Carlos Kumar",Egypt,21-09-2026,2024,PG,83 min,"Romantic Movies, Horror Movies",A gripping movie exploring themes of survival and identity in Egypt.,2026,September,Romantic Movies,83,
s967,Movie,The Silent Kingdom 967,Yuki Johnson,"Sara Rossi, Sara Lee, Yuki Silva",South Korea,12-10-2026,2023,R,121 min,"Sci-Fi & Fantasy, Children & Family Movies",A gripping movie exploring themes of survival and identity in South Korea.,2026,October,Sci-Fi & Fantasy,121,
s968,Movie,The Lost Rebellion 968,Unknown,"Raj Smith, Anil Patel, Anil Costa, John Costa, John Kumar, Hana Kumar",Japan,16-05-2020,2018,PG-13,177 min,Action & Adventure,A gripping movie exploring themes of survival and identity in Japan.,2020,May,Action & Adventure,177,
s969,Movie,The Lost Memory 969,Priya Rossi,"Aisha Patel, Anil Patel, Raj Patel, John Costa",Mexico,08-09-2023,2019,PG,82 min,"Thrillers, Horror Movies",A gripping movie exploring themes of survival and identity in Mexico.,2023,September,Thrillers,82,
s970,Movie,The Wild Shadows 970,Unknown,"David Park, Anil Rossi, Priya Tanaka",Japan,15-06-2020,2019,TV-PG,83 min,Sci-Fi & Fantasy,A gripping movie exploring themes of survival and identity in Japan.,2020,June,Sci-Fi & Fantasy,83,
s971,Movie,The Golden Kingdom 971,Carlos Lee,"Anil Nair, Yuki Lee, Fatima Rossi",United Kingdom,15-07-2024,2023,R,83 min,Dramas,A gripping movie exploring themes of survival and identity in United Kingdom.,2024,July,Dramas,83,
s972,Movie,The Broken Memory 972,Wei Lee,"Sara Rossi, Aisha Park, Aisha Johnson, Fatima Rossi, Raj Tanaka, John Patel, Raj Lee",Australia,06-07-2022,2022,TV-14,84 min,"Documentaries, Dramas, Independent Movies",A gripping movie exploring themes of survival and identity in Australia.,2022,July,Documentaries,84,
s973,Movie,The Hidden Shadows 973,Aisha Silva,"Maria Smith, Sara Johnson, Priya Patel, Carlos Nair, Maria Park, Elena Kumar",France,20-04-2018,2018,TV-MA,121 min,Children & Family Movies,A gripping movie exploring themes of survival and identity in France.,2018,April,Children & Family Movies,121,
s974,TV Show,The Golden Shadows 974,Unknown,"Raj Costa, Priya Costa, John Kumar, Min Johnson, Elena Müller",Japan,13-05-2025,2022,R,7 Seasons,Docuseries,A gripping tv show exploring themes of survival and identity in Japan.,2025,May,Docuseries,,7
s975,Movie,The Forgotten Dreams 975,Priya Nair,"Fatima Johnson, Raj Lee, Carlos Müller, Priya Lee, Wei Kumar, Fatima Johnson, Anil Costa",Mexico,24-01-2017,2014,TV-14,153 min,"Sci-Fi & Fantasy, Documentaries",A gripping movie exploring themes of survival and identity in Mexico.,2017,January,Sci-Fi & Fantasy,153,
s976,Movie,The Endless Rebellion 976,Carlos Müller,"Hana Rossi, Min Müller, John Nair",United States,27-11-2021,2021,TV-MA,146 min,"Thrillers, Independent Movies",A gripping movie exploring themes of survival and identity in United States.,2021,November,Thrillers,146,
s977,Movie,The Broken Legacy 977,John Garcia,"Elena Khan, Anil Rossi, Elena Johnson, Fatima Tanaka",Canada,18-10-2016,2016,TV-14,165 min,"Comedies, Thrillers",A gripping movie exploring themes of survival and identity in Canada.,2016,October,Comedies,165,
s978,TV Show,The Wild Legacy 978,Unknown,"Min Costa, Raj Smith, Fatima Garcia, Aisha Nair, Maria Kumar, Hana Rossi, Anil Patel",United Kingdom,14-06-2022,2020,TV-MA,3 Seasons,"Reality TV, Docuseries, TV Comedies",A gripping tv show exploring themes of survival and identity in United Kingdom.,2022,June,Reality TV,,3
s979,Movie,The Secret Shadows 979,Raj Müller,"John Nair, Priya Tanaka, Sara Müller, Min Garcia, John Smith",United Kingdom,03-02-2024,2020,TV-PG,122 min,Action & Adventure,A gripping movie exploring themes of survival and identity in United Kingdom.,2024,February,Action & Adventure,122,
s980,Movie,The Dark Promise 980,Priya Patel,"Fatima Khan, Maria Garcia, John Rossi, Sara Patel, Carlos Johnson, Min Patel",India,27-12-2024,2023,TV-Y,138 min,"Sci-Fi & Fantasy, Horror Movies, Dramas",A gripping movie exploring themes of survival and identity in India.,2024,December,Sci-Fi & Fantasy,138,
s981,TV Show,The Last Memory 981,Unknown,"Anil Silva, Elena Lee, Elena Müller, Priya Nair, Wei Nair, Hana Silva, Priya Khan",Japan,18-01-2020,2015,TV-MA,3 Season,Docuseries,A gripping tv show exploring themes of survival and identity in Japan.,2020,January,Docuseries,,3
s982,TV Show,The Golden Horizon Chronicles 982,Unknown,"Aisha Patel, Maria Rossi, Tom Johnson, Elena Müller, Anil Khan, Anil Johnson, Sara Tanaka",Japan,03-11-2023,2023,NR,3 Seasons,"TV Mysteries, Docuseries, Crime TV Shows",A gripping tv show exploring themes of survival and identity in Japan.,2023,November,TV Mysteries,,3
s983,Movie,The Golden Memory 983,Carlos Garcia,"Yuki Müller, Carlos Lee, Tom Lee, John Costa, Min Johnson, Tom Garcia",Nigeria,14-10-2023,2019,TV-PG,84 min,"Thrillers, Dramas",A gripping movie exploring themes of survival and identity in Nigeria.,2023,October,Thrillers,84,
s984,Movie,The Endless Legacy 984,Fatima Johnson,"Raj Khan, Min Patel, Yuki Garcia, Priya Rossi, Raj Garcia, David Smith",Mexico,20-01-2015,2014,TV-PG,123 min,"Horror Movies, Thrillers, Independent Movies",A gripping movie exploring themes of survival and identity in Mexico.,2015,January,Horror Movies,123,
s985,Movie,The Wild Promise 985,Unknown,"Carlos Khan, Tom Patel, Carlos Johnson, Anil Silva, Maria Khan, Tom Rossi, Maria Costa",Australia,12-03-2023,2023,PG-13,144 min,Thrillers,A gripping movie exploring themes of survival and identity in Australia.,2023,March,Thrillers,144,
s986,TV Show,The Lost Kingdom Chronicles 986,Unknown,"Priya Khan, Priya Tanaka, John Johnson",India,19-10-2015,2014,TV-MA,2 Seasons,TV Mysteries,A gripping tv show exploring themes of survival and identity in India.,2015,October,TV Mysteries,,2
s987,Movie,The Golden City 987,Unknown,"Elena Park, Aisha Kumar, David Garcia, Carlos Kumar",Spain,22-06-2026,2022,TV-MA,166 min,"Action & Adventure, Documentaries, Thrillers",A gripping movie exploring themes of survival and identity in Spain.,2026,June,Action & Adventure,166,
s988,Movie,The Broken Empire 988,Sara Khan,"Elena Garcia, Fatima Smith, John Silva, David Müller, Anil Nair",Italy,17-09-2019,2017,PG-13,82 min,"Romantic Movies, Dramas",A gripping movie exploring themes of survival and identity in Italy.,2019,September,Romantic Movies,82,
s989,Movie,The Wild Empire 989,Elena Park,"Maria Park, Fatima Johnson, Anil Patel",France,09-05-2015,2013,TV-14,73 min,"Thrillers, Sci-Fi & Fantasy, Comedies",A gripping movie exploring themes of survival and identity in France.,2015,May,Thrillers,73,
s990,Movie,The Broken City 990,Unknown,"Min Khan, Aisha Patel, John Costa",Japan,28-01-2020,2020,TV-Y,121 min,"Independent Movies, Action & Adventure",A gripping movie exploring themes of survival and identity in Japan.,2020,January,Independent Movies,121,
s991,Movie,The Eternal Shadows 991,Carlos Park,"Tom Park, Min Khan, Tom Johnson, Yuki Park, Priya Lee, David Johnson, Fatima Lee",Germany,06-10-2021,2020,PG,120 min,"Thrillers, Horror Movies, Sci-Fi & Fantasy",A gripping movie exploring themes of survival and identity in Germany.,2021,October,Thrillers,120,
s992,Movie,The Lost Shadows 992,Anil Nair,"Sara Tanaka, Tom Park, Anil Lee, John Smith, Elena Smith, Aisha Müller",Canada,04-02-2023,2018,TV-PG,148 min,Sci-Fi & Fantasy,A gripping movie exploring themes of survival and identity in Canada.,2023,February,Sci-Fi & Fantasy,148,
s993,TV Show,The Eternal Journey 993,Unknown,"Maria Smith, Fatima Lee, Sara Johnson, Anil Silva, Elena Kumar, Anil Kumar",Mexico,27-04-2014,2013,TV-PG,7 Seasons,"Romantic TV Shows, Kids' TV",A gripping tv show exploring themes of survival and identity in Mexico.,2014,April,Romantic TV Shows,,7
s994,TV Show,The Wild Journey Chronicles 994,Unknown,"Yuki Silva, Tom Müller, Fatima Costa",India,26-05-2026,2025,PG,3 Seasons,"TV Mysteries, Docuseries, Crime TV Shows",A gripping tv show exploring themes of survival and identity in India.,2026,May,TV Mysteries,,3
s995,Movie,The Secret City 995,Fatima Garcia,"Yuki Lee, Aisha Nair, Sara Rossi",Australia,14-07-2008,2008,TV-G,133 min,"Dramas, Romantic Movies",A gripping movie exploring themes of survival and identity in Australia.,2008,July,Dramas,133,
s996,Movie,The Lost Dreams 996,Hana Costa,"Raj Silva, Maria Tanaka, Sara Khan, Tom Silva, Maria Nair, Wei Costa, Aisha Lee",Unknown,01-09-2018,2016,TV-PG,143 min,"Horror Movies, Romantic Movies",A gripping movie exploring themes of survival and identity in Canada.,2018,September,Horror Movies,143,
s997,Movie,The Eternal Promise 997,Raj Park,"Wei Nair, Wei Smith, Wei Garcia, Yuki Garcia, Min Silva, Elena Park",India,04-01-2021,2019,TV-G,120 min,"Romantic Movies, Sci-Fi & Fantasy, Documentaries",A gripping movie exploring themes of survival and identity in India.,2021,January,Romantic Movies,120,
s998,TV Show,The Wild Dreams 998,Unknown,"Priya Garcia, Fatima Park, John Smith",Spain,13-05-2021,2021,TV-G,3 Seasons,"TV Comedies, TV Action & Adventure, TV Dramas",A gripping tv show exploring themes of survival and identity in Spain.,2021,May,TV Comedies,,3
s999,Movie,The Golden Promise 999,Raj Smith,"Tom Rossi, Elena Patel, Maria Tanaka, Priya Garcia, Sara Rossi, Raj Costa",United States,26-09-2020,2018,TV-MA,136 min,"Thrillers, Dramas, Independent Movies",A gripping movie exploring themes of survival and identity in United States.,2020,September,Thrillers,136,
s1000,TV Show,The Broken Empire 1000,Unknown,"Maria Park, John Garcia, Anil Tanaka",United States,23-03-2023,2022,TV-14,7 Seasons,TV Action & Adventure,A gripping tv show exploring themes of survival and identity in United States.,2023,March,TV Action & Adventure,,7
s1001,Movie,The Dark Dreams 1001,Anil Rossi,"Sara Nair, Wei Lee, Fatima Patel, Wei Khan, Maria Smith, Carlos Patel, David Khan",Spain,11-08-2012,2011,TV-PG,99 min,"Romantic Movies, Thrillers",A gripping movie exploring themes of survival and identity in Spain.,2012,August,Romantic Movies,99,
s1002,Movie,The Secret Dreams 1002,Yuki Müller,"David Park, Maria Nair, Hana Nair, Priya Smith, Maria Tanaka, Maria Park",Egypt,02-01-2018,2017,TV-MA,156 min,"Horror Movies, Sci-Fi & Fantasy",A gripping movie exploring themes of survival and identity in Egypt.,2018,January,Horror Movies,156,
